{"schema_version":"3.0.0","query":"Manchester City vs Arsenal","sport":"soccer","timestamp_utc":"2026-09-27T04:27:58Z","agents_executed":["scout","actuary","context","strategist"],"agents_failed":[],"markets_scanned_count":0,"raw_prices_seen":0,"sources":{"betika":"empty","odibets":"empty","flashscore":"empty","espn_mirror":"no_fixture"},"context_available":false,"mode":"math_only","top_edges":[],"visual_reports_png":[],"data_policy":"real scraped prices only; empty top_edges means no verified edge — never fabricated odds","status":"no_results","error_message":"No tradable edge found for 'Manchester City vs Arsenal'. 0 markets scanned, 0 valid handles, 0 positive EV after vig removal. This is an honest empty result, not a bug."}