{"schema_version":"3.0.0","query":"Al Hilal vs Al Nassr","sport":"soccer","timestamp_utc":"2026-09-27T07:24:01Z","agents_executed":["scout","actuary","context","strategist"],"agents_failed":[],"markets_scanned_count":0,"raw_prices_seen":0,"sources":{"betika":"spa_shell_deferred_to_pw","odibets":"error","flashscore":"not_found","espn_mirror":"blocked_waf"},"context_available":false,"mode":"math_only","top_edges":[],"visual_reports_png":[],"data_policy":"real scraped prices only; empty top_edges means no verified edge — never fabricated odds","status":"no_results","error_message":"No tradable edge found for 'Al Hilal vs Al Nassr'. Source telemetry: betika=DEFERRED_TO_PLAYWRIGHT_PHASE_B (JS-rendered board, no static odds); odibets=scraper error; flashscore=NOT_FOUND (stale route); espn_mirror=BLOCKED_BY_WAF (site refused our IP/headers). 0 markets scanned, 0 valid handles, 0 positive EV after vig removal. This is an honest empty result, not a bug."}